{
  "schemaVersion": "v1",
  "root": {
    "name": "python-development",
    "version": "1.2.0",
    "reference": "oci://registry.example.com/agentskills/python-development:1.2.0"
  },
  "packages": [
    {
      "name": "python-development",
      "version": "1.2.0",
      "digest": "sha256:1111111111111111111111111111111111111111111111111111111111111111",
      "reference": "oci://registry.example.com/agentskills/python-development@sha256:1111111111111111111111111111111111111111111111111111111111111111"
    },
    {
      "name": "prd",
      "version": "1.1.0",
      "digest": "sha256:2222222222222222222222222222222222222222222222222222222222222222",
      "reference": "oci://registry.example.com/agentskills/prd@sha256:2222222222222222222222222222222222222222222222222222222222222222"
    },
    {
      "name": "implementation",
      "version": "2.3.4",
      "digest": "sha256:3333333333333333333333333333333333333333333333333333333333333333",
      "reference": "oci://registry.example.com/agentskills/implementation@sha256:3333333333333333333333333333333333333333333333333333333333333333"
    },
    {
      "name": "tdd",
      "version": "1.4.2",
      "digest": "sha256:4444444444444444444444444444444444444444444444444444444444444444",
      "reference": "oci://registry.example.com/agentskills/tdd@sha256:4444444444444444444444444444444444444444444444444444444444444444"
    },
    {
      "name": "deployment",
      "version": "1.1.3",
      "digest": "sha256:5555555555555555555555555555555555555555555555555555555555555555",
      "reference": "oci://registry.example.com/agentskills/deployment@sha256:5555555555555555555555555555555555555555555555555555555555555555"
    }
  ],
  "edges": [
    {
      "from": "python-development",
      "to": "prd",
      "relationship": "required"
    },
    {
      "from": "python-development",
      "to": "implementation",
      "relationship": "required"
    },
    {
      "from": "python-development",
      "to": "tdd",
      "relationship": "recommended"
    },
    {
      "from": "python-development",
      "to": "deployment",
      "relationship": "recommended"
    }
  ]
}
